{
  "schema_version": "1",
  "event_id": "evt_example_mdm_command_full_json",
  "type": "protocol.mdm.exchange",
  "occurred_at": "2026-09-20T12:00:00Z",
  "source": "mdm",
  "subject": {
    "kind": "enrollment",
    "id": "55693EB3-DF03-5FD1-9263-F7CDB8AD7FFD",
    "channel": "device"
  },
  "correlation_id": "corr_example_exchange",
  "data": {
    "command_uuid": "41d35de3-a343-4146-ba4b-0069bae2a54f",
    "device_status": "Acknowledged",
    "http": {
      "duration_ms": 0,
      "method": "PUT",
      "response_complete": true,
      "route": "/mdm",
      "status": 200
    },
    "operation": "connect",
    "outcome": "succeeded"
  },
  "payloads": {
    "request_json": {
      "content_type": "application/json",
      "encoding": "json",
      "availability": "complete",
      "size": 124,
      "sha256": "0466a678e698398f1daf39596a5e50b7626cb997f8e45a7c57b05ade558f01ee",
      "value": {
        "CommandUUID": "41d35de3-a343-4146-ba4b-0069bae2a54f",
        "Status": "Acknowledged",
        "UDID": "55693EB3-DF03-5FD1-9263-F7CDB8AD7FFD"
      }
    },
    "response_json": {
      "content_type": "application/json",
      "encoding": "json",
      "availability": "empty",
      "size": 0
    }
  }
}
