{
  "schema_version": "1",
  "event_id": "evt_example_large_reference",
  "type": "protocol.mdm.exchange",
  "occurred_at": "2026-09-20T12:00:00Z",
  "source": "mdm",
  "correlation_id": "corr_example_exchange",
  "data": {
    "http": {
      "duration_ms": 0,
      "method": "PUT",
      "response_complete": true,
      "route": "/mdm",
      "status": 400
    },
    "operation": "unknown",
    "outcome": "rejected"
  },
  "payloads": {
    "request_raw": {
      "content_type": "application/x-apple-aspen-mdm",
      "encoding": "base64",
      "availability": "complete",
      "size": 262144,
      "sha256": "d509bff642a353f88582e8a846ecae041c333b79c57a7a24ff310fbdb7e914e9",
      "href": "/webhooks/v1/payloads/delivery_example/request_raw",
      "expires_at": "2026-09-27T12:00:00Z"
    },
    "response_raw": {
      "content_type": "application/xml",
      "encoding": "base64",
      "availability": "complete",
      "size": 12,
      "sha256": "0cd6aed5d21ae37310b3c4e0facf48009005018bf4402fbcda1cb66d69b03346",
      "href": "/webhooks/v1/payloads/delivery_example/response_raw",
      "expires_at": "2026-09-27T12:00:00Z"
    }
  }
}
